05:36:12.914948 IP 10.0.0.2.37414 > 192.168.0.2.domain: [|domain]
05:36:12.914966 IP 192.168.0.2 > 10.0.0.2: ICMP 192.168.0.2 udp port domain unreachable, length 40
05:38:01.127208 IP 192.168.0.2.36706 > 10.0.0.2.http: Flags [S], seq 1603178418, win 29200, options [mss 1460,sackOK,TS val 711266 ecr 0,nop,wscale 9], length 0
05:38:02.397823 IP 192.168.0.2.36706 > 10.0.0.2.http: Flags [S], seq 1603178418, win 29200, options [mss 1460,sackOK,TS val 711583 ecr 0,nop,wscale 9], length 0
05:38:04.415395 IP 192.168.0.2.36706 > 10.0.0.2.http: Flags [S], seq 1603178418, win 29200, options [mss 1460,sackOK,TS val 712088 ecr 0,nop,wscale 9], length 0
